{
  "$schema": "http://json-schema.org/draft-07/schema#",
  "$id": "https://github.com/aloknigam/agent-org/org.schema.json",
  "title": "Agent Org",
  "description": "Sole live configuration at .github/agent-org/org.json. Paths and ownership globs are repository-root-relative, never config-directory-relative. This schema validates structure; owner_validator.py validates managed coverage and tree semantics.",
  "type": "object",
  "additionalProperties": false,
  "required": ["version", "root", "nodes"],
  "properties": {
    "version": {
      "type": "integer",
      "description": "Per-org evolution counter, not a file-layout version. Bumped by exactly one on every applied split."
    },
    "root": {
      "type": "string",
      "description": "Configured entry node. Bootstrap defaults to main; the Host reads this field.",
      "not": { "enum": ["host", "splitter"] },
      "pattern": "^[a-z][a-z0-9-]*$"
    },
    "nodes": {
      "type": "array",
      "minItems": 1,
      "items": { "$ref": "#/definitions/node" }
    },
    "collaboration": {
      "enum": ["agents", "hybrid"],
      "default": "agents",
      "description": "agents uses the org workflow; hybrid also reconciles between-run human changes."
    },
    "scope": {
      "type": "array",
      "minItems": 1,
      "items": { "type": "string", "minLength": 1 },
      "default": ["**"],
      "description": "Repository-root-relative managed code globs, independent of collaboration and stable through splits. Paths outside this scope are unmanaged and allowed; gaps inside it remain UNOWNED. Never infer scope from a Parent's retained domain."
    },
    "storage": {
      "enum": ["local", "tracked"],
      "default": "local",
      "description": "local excludes exact overlay files via Git's common info/exclude; tracked leaves them ready for version control. Runtime worktrees and caches remain excluded in both modes."
    }
  },
  "definitions": {
    "node": {
      "type": "object",
      "additionalProperties": false,
      "required": ["id", "parent", "children", "mode", "charter"],
      "properties": {
        "id": {
          "type": "string",
          "pattern": "^[a-z][a-z0-9-]*$",
          "description": "Stable, hierarchy-free identifier. Never renamed across reorgs.",
          "not": { "enum": ["host", "splitter"] }
        },
        "parent": {
          "type": ["string", "null"],
          "description": "id of the parent node, or null for the root."
        },
        "children": {
          "type": "array",
          "items": { "type": "string" },
          "description": "ids of direct children. Empty for a Leaf."
        },
        "mode": {
          "enum": ["Parent", "Leaf"],
          "description": "Parent = scatter-gather over children. Leaf = executes directly."
        },
        "charter": { "$ref": "#/definitions/charter" }
      }
    },
    "charter": {
      "type": "object",
      "additionalProperties": false,
      "required": ["domain", "concerns", "excludes"],
      "properties": {
        "domain": {
          "type": "array",
          "minItems": 1,
          "items": { "type": "string" },
          "description": "Repository-root-relative glob patterns (gitignore semantics) the node owns. For a Parent this is an explicit shared set (root/org/contract files common to its children), never '**'. Effective domain = domain minus excludes."
        },
        "concerns": {
          "type": "array",
          "items": { "type": "string" },
          "description": "Human-readable responsibilities inside the domain."
        },
        "excludes": {
          "type": "array",
          "items": { "type": "string" },
          "description": "Globs a node's domain would match but that are owned elsewhere (a cross-cutting sibling). Effective domain = domain minus excludes. A materialized excluded path that no other node covers surfaces as UNOWNED via the owner-oracle; see the agent-org-design skill §2.2, §2.7."
        }
      }
    }
  }
}
